406018;SmaCoNat: Smart Contracts in Natural Language;48;"E. Regnath ; S. Steinhorst";Smart contracts enable autonomous decentralized organizations (DADs) in large, trustless and open trading networks by specifying conditions for automated transactions of cryptographically secured data. This data could represent cryptocurrencies but also sensor data or commands to Cyber-Physical Systems (CPS) connected to the Internet. To provide reliability, the contract code is enforced by consensus and the transactions it triggers are nonrevertible, even if they were not intended by the programmer, which could lead to dangerous system behavior. In this paper, we conduct a survey over existing smart contract platforms and languages to determine requirements for the design of a safer contract language. Subsequently we propose concepts that enhance the understanding of code by limiting confusing language constructs, such as nesting, arbitrary naming of operations, and unreadable hash identifiers. This enables human reasoning about the contract semantics on a much higher abstraction layer, because a common understanding can be derived from the language specification itself. We implement these concepts in a new domain specific language called SmaCoNat to illustrate the feasibility and show that our concepts are barely covered by existing languages but significantly enhance readability and safety without violating deterministic parsability.;ACCEPTED;ACCEPTED;LOW;46;2018;2018 Forum on Specification & Design Languages (FDL);"business data processing;contracts;cryptography;formal specification;Internet;specification languages;contract semantics;language specification;domain specific language;autonomous decentralized organizations;trustless trading networks;open trading networks;automated transactions;cryptographically secured data;contract code;smart contract platforms;cyber-physical systems;SmaCoNat;cryptocurrencies;CPS;Internet;contract language safety;deterministic parsability;Global Positioning System;Hafnium compounds;Contracts;TV;Optical fibers;Law;Smart Contract;DSL;Blockchain;IoT;CPS";Conference Paper;;https://ieeexplore--ieee--org.us.debiblio.com/document/8524068;;;10.1109/FDL.2018.8524068;1636-9874;;;N;N;N;N;N;Y;N;N;N;;SmaCoNat;Y;N;N;N;Y;N;Agnostic;Y;N;Natural Language;Technical University of Munich;Y;N;"Most existing implementations execute low-level byte code in a Turing-complete virtual machine, or restrict contract capabilitites to fixed templates that offer simple conditional execution of transactions.

The high diversity of the languages used to program smart contracts illustrates the problem that there is not suitable known language yet and the platforms often attempt to create such a language by their own.

Most implementations identified the need to limit language constructs to achieve a determinstically terminating program which achieves some safety on the execution level.

On the semantic level there is no effort to provide safety by providing a common understanding for all involved parties.

What is also missing is the concept of permissions. Accounts need to authenticate via a signature to transfer their assets but beyond that there are no restrictions for transactions of assests";null;N;Y;N; 
406019;Automatic Smart Contract Generation Using Controlled Natural Language and Template;48;"T. Tateishi ; S. Yoshihama ; N. Sato ; S. Saito";Smart contracts, which are widely recognized as key components of blockchain technology, enable automatic execution of agreements. Since each smart contract is a computer program that autonomously runs on a blockchain platform, their development requires much effort and care compared with the development of more common programs. In this paper, we propose a technique to automatically generate a smart contract from a human-understandable contract document that is created using a document template and a controlled natural language (CNL). The automation is based on a mapping from the document template and the CNL to a formal model that can define the terms and condition in a contract including temporal constraints and procedures. The formal model is then translated into an executable smart contract. We implemented a toolchain that generates smart contracts of Hyperledger Fabric from template-based contract documents via a formal model. We then evaluated the feasibility of our approach through case studies of two types of real-world contracts in different domains.;ACCEPTED;ACCEPTED;LOW;28;2019;IBM Journal of Research and Development;;Journal Paper;I can not download the paper from IEEE;https://ieeexplore--ieee--org.us.debiblio.com/document/8645646;;;10.1147/JRD.2019.2900643;0018-8646;;;N;N;N;N;N;Y;N;N;N;;DSL4SC;N;Y;N;N;Y;N;Hyperledger;N;Y;"Natural Language
legal contracts";IBM Research – Tokyo, Tokyo;Y;N;We believe that the automated smart contract generation will be one of the key technologies in the future of blockchain.;"*purchase agreement
*forward accumulator
";N;Y;N; 
413256; Beagle: A new framework for smart contracts taking account of law;52;"Tsai, W.-T. ; Ge, N. ; Jiang, J. ; Feng, K. ; He, J.";This paper presents a new Beagle framework for Smart Contracts (SCs) taking account of law. Different from previous SC development or execution frameworks, this framework takes a practical approach to integrate law into SCs. Instead of translating legal contracts into codes directly, this paper proposes to treat SCs as a key component of legal contracts, use SCs to partially automate the executions of legal contracts, and produce legal evidence during the process. Thus, the proposed SC design will be significantly different from previous SC designs, not in programming languages to be used, but in the way SCs are designed and executed. This Beagle framework has five stages: SC template development from domain analysis, formal SC model and code development from templates, verification and validation (V&V), SC execution, and runtime monitoring. Â© 2019 IEEE.;ACCEPTED;ACCEPTED;LOW;13;2019; 2019 IEEE International Conference on Service-Oriented System Engineering (SOSE);"Blockchains;Formal verification;Law;Smart contracts;Templates;Cloud computing;Formal verification;Robotics;Systems engineering;Blockchains;Code development;Domain analysis;Execution framework;Legal contracts;Runtime Monitoring;Templates;Verification-and-validation;Contracts";Conference paper;"DISCUSSION
TR- No lo tengo claro. Al final el artículo lo que hace es discutir qué se tiene que cambiar en los SC actuales para incorporar aspectos legales, pero no propone ningún lenguajes. Además, Beagle es un framework.	
AV-Aceptamos. Yo creo que si se propone un lenguaje desde el punto de vista de la deficinión de una pantilla y luego su concreción con natural language como se indica en la sección 5. Yo aceptaría como una propuesta que propone un lenguaje de smart contract";https://ieeexplore.ieee.org/document/8705875;;;10.1109/SOSE.2019.00028;9781728114415 (ISBN);;;N;N;N;N;N;Y;N;N;N;;Beagle;N;Y;N;N;Y;N;null;Y;N;Legal contracts;" Digital Society & Blockchain Laboratory, Beihang University, Beijing, China
School of Software, Beihang University, Beijing, China
Emory University School of Law, Atlanta, Georgia 30329, USA
Arizona State University, Tempe, AZ 85287, USA
Beijing Tiande Technologies, Beijing, China
Andrew International Sandbox Institute, Qingdao, China
IOB Laboratory, National Big Data Comprehensive Experimental Area, Guizhou, China";Y;N;"This section discusses five
important issues related to the V&V of SCs:
x What are the differences between SC software and traditional software?
x What are the sources of SC faults?
x What are the SC desirable properties?
x In which stages of SC development should perform V&V by using what methods and tools?
x How can one apply crowdsourcing to SC V&V?

* In cryptocurrency, transactions cannot be reversed. But, in most
countries, transactions can be reversed even few days after trade completion, e.g

* Currently SCs complete transactions without third parties as in
cryptocurrency systems, but this will not be true in financial systems. Under the current law, parties involved must sign legal documents before they become binding. Thus, development and execution of SCs without signatures under the current law will not be legally valid. Not only signatures, numerous transactions today require external legal documents
not available in SCs, e.g., property ownership certificates. These can eventually be digitized too, e.g., they can be issued as digital certificates stored in BCs, but currently they are not, and thus current
SCs must live under the current legal condition.
These should be considered in performing V&V for SCs.

* Once SCs consider the legal aspects, SC design need to make significant changes, and most of changes will be needed in the SC
development and infrastructure. 
";null;N;Y;N; 
413274;Introducing commitRuleML for smart contracts;52;"de Kruijff, J. ; Weigand, H. ; Johannesson P. ; Weigand H. ; Andersson B.";This short paper takes a closer look at the Event Calculus and the formalisms for representing and reasoning about the effects of automated actions and the commitments that result from them. Since the Event Calculus deals with local events and the consideration of time, it enables the uniform representation of basic-, conditional and persistent commitments, including its operations and reasoning rules about them. Due to the similarities between event, action and state processing and reaction rules, we extend KR ReactionRuleML to emphasize syntax and semantics relevant for commitments, called CommitRuleML. CommitRuleML is used to define commitment-based smart contracts (CBSCs) as contracts that logically (through the Event Calculus) define events (on), conditions (if) and actions (do) in an executable language. A simplified running example illustrates how commitments evolve and fulfill over time. Â© 2019 CEUR-WS. All rights reserved.;ACCEPTED;ACCEPTED;LOW;13;2019;Proceedings of the 13th International Workshop on Value Modeling and Business Ontologies;"CommitRuleML;Event Calculus;KR ReactionRuleML;Smart Contracts;Logic programming;Ontology;Semantics;CommitRuleML;Event calculus;Reaction rules;Reasoning rules;Calculations";Workshop paper;;ceur-ws.org/Vol-2383/paper14.pdf ;2383;;;16130073 (ISSN) ;;;N;N;N;N;N;Y;N;N;N;;CommitRuleML;N;Y;N;N;Y;N;n/a;N;Y;Commitment-based Smart contract;Tilburg University;Y;N;"Future research could extend the running example by more complex
use cases that include persistent commitments, partial fulfillments (e.g. payments) and discourse resolution";eCommerce transaction;N;Y;N; 
413285;Smart contracts using blockly: Representing a purchase agreement using a graphical programming language;52;"Weingaertner, T. ; Rao, R. ; Ettlin, J. ; Suter, P. ; Dublanc, P.";This research addresses the issue that in-depth programming knowhow is needed to read and write smart contracts. The goal was making the creation of smart contracts accessible to non-computer experts by the use of a graphical programming language (Blockly). We used modularization to capture the complexity of legal contracts and developed a mapping process to transform the graphical representation to the smart contract programming language Solidity. We applied our approach to legal purchase agreements and proved the practicality of our solution and explored its limitations. A prototype was built to show the feasibility of our approach. Our industry partner challenged the prototype by applying it to the contract creation process. We consider our work as the first step towards an application of smart contracts in the non-IT world and outside the today's expert shaped ecosystem of blockchain specialists. Several continuative research questions have been derived from our finding and are listed at the end of this paper. Â© 2018 IEEE.;ACCEPTED;ACCEPTED;LOW;36;2018; 2018 Crypto Valley Conference on Blockchain Technology (CVCBT);"Blockchain;Blockly;Modularization;Smart contracts;Solidity;Blockchain;Computer graphics;Modular construction;Technology transfer;Blockly;Graphical programming language;Graphical representations;Modularizations;Purchase agreements;Research questions;Smart contracts;Solidity;Ada (programming language)";Conference paper;;https://ieeexplore--ieee--org.us.debiblio.com/document/8525393;;;10.1109/CVCBT.2018.00012;9781538672044 (ISBN);;;N;N;N;N;N;Y;N;N;N;;Smart contracts using Blockly;N;N;Y;N;Y;N;Ethereum;N;Y;legal contracts;"School of Information Technology
Lucerne University of Applied Sciences & Arts";N;Y;"1) Exchange and return: The blockchain stores transaction data irreversibly in a database. In the Swiss Law (OR, Article 40a ff.) the right of withdrawal is clearly regulated. It is also a service of many companies to increase customer satisfaction. Smart contracts have to address this right.

2) Dunning process: In case of late delivery a dunning process has to be installed. A dunning for the payment is not needed since the money is reserved from both partners by entering the contract. Moreover a dunning process for conferment and delivery has to be installed

3) Oracles: Oracles offer a link to functionality outside the blockchain. They can be used for the integration of banking service providers or credit card companies. However, through this integration an advantage of the blockchain is lost as there is a third party, which interacts between the end user and the blockchain.

4) Contract elements: It has been decided for the presented implementation that due to the increasing transaction costs, not all attributes of the contract are mapped in the smart contract. However, as this extension would be closer to practice, this could be further elaborated in another work

5) Crypto-currencies: As long as crypto-currencies are not officially recognized on the market, an intermediate solution with Fiat money should be made possible in order to promote the use of smart contracts. The actual volatility of crypto-currencies is another obstacle for legal contracts

6)  International acceptance: Digitalization progress varies from country to country. It will take some time before a smart contract is internationally accepted. This is a research task for the legal domain";purchase agreement;N;Y;N; 
413298;KEVM: A complete formal semantics of the ethereum virtual machine;52;"Hildenbrandt, E. ; Saxena, M. ; Rodrigues, N. ; Zhu, X. ; Daian, P. ; Guth, D. ; Moore, B. ; Park, D. ; Zhang, Y. ; Stefanescu, A. ; Rosu, G.";A developing field of interest for the distributed systems and applied cryptography communities is that of smart contracts: Self-executing financial instruments that synchronize their state, often through a blockchain. One such smart contract system that has seen widespread practical adoption is Ethereum, which has grown to a market capacity of 100 billion USD and clears an excess of 500,000 daily transactions. Unfortunately, the rise of these technologies has been marred by a series of costly bugs and exploits. Increasingly, the Ethereum community has turned to formal methods and rigorous program analysis tools. This trend holds great promise due to the relative simplicity of smart contracts and bounded-time deterministic execution inherent to the Ethereum Virtual Machine (EVM). Here we present KEVM, an executable formal specification of the EVM's bytecode stack-based language built with the K Framework, designed to serve as a solid foundation for further formal analyses. We empirically evaluate the correctness and performance of KEVM using the official Ethereum test suite. To demonstrate the usability, several extensions of the semantics are presented. and two different-language implementations of the ERC20 Standard Token are verified against the ERC20 specification. These results are encouraging for the executable semantics approach to language prototyping and specification. Â© 2018 IEEE.;ACCEPTED;ACCEPTED;LOW;26;2018;2018 IEEE 31st Computer Security Foundations Symposium (CSF);"blockchain;ethereum;ethereum-virtual-machine;evm;formal-methods;k-framework;kevm;semantics;smart-contract;verification;Blockchain;Computer aided software engineering;Formal methods;Network security;Security systems;Semantics;Verification;Virtual machine;Deterministic execution;ethereum;Executable formal specification;Executable semantics;kevm;Language implementations;Smart contracts;Stack-based languages;Formal specification";Conference paper;;https://ieeexplore.ieee.org/document/8429306;2018-July;;10.1109/CSF.2018.00022;"19401434 (ISSN); 9781538666807 (ISBN)";;;N;N;N;N;N;Y;N;N;N;;K;Y;N;N;N;Y;N;Ethereum;Y;N;Smart contract verification;"University of Illinois at Urbana-Champaign
Runtime Verification, Inc.
Cornell Tech, IC3
East China Normal University";Y;N;"* Future EVM Hardforks:he current semantics is parametric over the selected fee schedule. The EVM will continue to evolve as new opcodes
are added and gas prices are changed, and the specification will need to evolve with it
* Analysis Tools: Another key direction is the formalization of classically known contract antipatterns, specifically
those that have lead to exploits in the past.
* ABI-Level DSL: Currently our ABI-level DSL only supports statically-sized ABI types, but the ABI contains several dynamically sized types as well
*Verified EVM Libraries: To further assist others in building high-assurance contracts, we intend to provide fully verified library contracts.";null;N;Y;N; 
413303;Secure Smart Contract System Built on SMPC over Blockchain;52;"Zhu, Y. ; Song, X. ; Yang, S. ; Qin, Y. ; Zhou, Q.";While smart contracts are praised widely, it should be noted that they have their disadvantages: lack of control over data protection and executive correctness or consistency. Aiming at this problem, we propose SMPC-based smart contract platform with three-layer structure: contract, computing, and group communication layer. In contract layer, we put forward SMPC-based smart contract framework, which gives the implementation process, language structure and grammar specification of smart contracts. In computing layer, fair SMPC algorithms based on general linear secret sharing scheme are designed to implement verifiable collaboration computing with input privacy and computation correctness. In group communication layer, the non-blocking broadcast is developed from non-blocking message passing interface (MPI)in order to ensure secure group communication in asynchronous networks with node and link failures. Finally, the results of simulation experiments with private currency transfers indicate that our platform is efficient and secure enough for common smart contracts. Â© 2018 IEEE.;ACCEPTED;ACCEPTED;LOW;25;2018; 2018 IEEE International Conference on Internet of Things (iThings) and IEEE Green Computing and Communications (GreenCom) and IEEE Cyber, Physical and Social Computing (CPSCom) and IEEE Smart Data (SmartData);"blockchain;non-blocking MPI;secure multi-party computation;smart contract;Blockchain;Internet of things;Message passing;Simulation platform;Asynchronous networks;Implementation process;Linear secret sharing schemes;Message passing interface;Non-blocking;Secure group communications;Secure multi-party computation;Three-layer structures;Green computing";Conference paper;;https://ieeexplore.ieee.org/document/8726574;;;10.1109/Cybermatics_2018.2018.00259;9781538679753 (ISBN);;;N;N;N;N;N;Y;N;N;N;;SMPC;Y;N;N;N;Y;N;null;N;Y;"Security
";"University of Science and Technology Beijing, Beijing, China
Economy and Informatization, Beijing, China";Y;N;"However, there are two disadvantages of security mechanisms in the existing smart contracts: 1) data privacy and 2) executive security

In the aspect of data privacy, smart contract lacks a cryptographic mechanism, which deals with encrypted sensitive
data

In the aspect of executive security, a security mechanism is need to ensure the correctness of performing smart
contract.";transfer smart contract;Y;N;N; 
413305;Formal requirement enforcement on smart contracts based on linear dynamic logic;52;"Sato, N. ; Tateishi, T. ; Amano, S.";Recently, despite the growing popularity of smart contracts, one serious concern is arising among both industry and academia, that is, whether they work autonomously without human intervention really as intended and, when we are not sure, how we can ensure that contracts meet particular requirements. To resolve this, we propose a new formal approach to smart contract development: Instead of defining contracts just as programs in conventional languages, they should be defined using formal logic so that we can verify whether they meet particular requirements and enforce them if necessary. The primary challenge is that expressive formal logic often turns out to be undecidable and consequently executable programs cannot be generated. As a solution, each contract definition is divided into two layers, namely specification layer in a decidable logic called Linear Dynamic Logic for verification and enforcement of requirements and rule layer for defining implementation details, while the consistency between the two layers is systematically guaranteed. Based on this, it also becomes possible to automatically generate executable contract programs from their formal specification, which leads to improving the trustworthiness of contracts. Evaluation on Hyperledger Fabric shows the feasibility and high effectiveness of our approach. Â© 2018 IEEE.;ACCEPTED;ACCEPTED;LOW;14;2018;2018 IEEE International Conference on Internet of Things (iThings) and IEEE Green Computing and Communications (GreenCom) and IEEE Cyber, Physical and Social Computing (CPSCom) and IEEE Smart Data (SmartData);"Blockchain;Dynamics;Formal logic;Formal specification;Green computing;Internet of things;Contract projects;Executable programs;Formal approach;Human intervention;Linear dynamics;Computer circuits";Conference paper;;https://ieeexplore.ieee.org/document/8726750;;;10.1109/Cybermatics_2018.2018.00181;9781538679753 (ISBN);;;N;N;N;N;N;Y;N;N;N;;DSL;N;Y;N;N;Y;N;Hyperledger Fabric;N;Y;Formal specification;IBM Research;Y;N;"Firstly, we plan to take into account multiple contracts interacting with each other.

Secondly, we also plan to formally ensure the refinement/abstraction relations between the code and the non-code parts of a rule.

Thirdly, from a practicality point of view, extending our DSL to supporting contract composition and automatic generation, as discussed in Sec V-C and Sec V-E, is another option.

Finally, for higher efficiency, instead of deriving a statechart from each contract definition, which is a specialization of a rule-set to the contract, we could have different contracts run on a single common (RETE-based) rule engine
";"toggle switch’ contract
Safe Remote Purchase (SRP) contract
SRP Seller and Buyer";Y;N;N; 
413306;ZoKrates-Scalable Privacy-Preserving Off-Chain Computations;52;"Eberhardt, J. ; Tai, S.";Scalability and privacy are two challenges for today's blockchain systems. Processing transactions at every node in the system limits the system's ability to scale. Furthermore, the requirement to publish all corporate or individual information for processing at every node, essentially making the data public, is-despite of all other advantages-often considered a major obstacle to blockchain adoption. In this paper, we make two main contributions to address these two problems: (i)To increase efficiency, we propose a processing model which employs noninteractive proofs to off-chain computations, thereby reducing on-chain computational efforts to the verification of correctness of execution rather than the execution itself. Due to the verifiable computation scheme's zero-knowledge property, private information used in the off-chain computation does not have to become public to verify correctness. (ii)We introduce ZoKrates, a toolbox to specify, integrate and deploy such off-chain computations. It consists of a domain-specific language, a compiler, and generators for proofs and verification Smart Contracts. ZoKrates hides significant complexity inherent to zero-knowledge proofs, provides a more familiar and higher level of programming abstractions to developers and enables circuit integration, hence fostering adoption. Â© 2018 IEEE.;ACCEPTED;ACCEPTED;LOW;10;2018;Proceedings - IEEE 2018 International Congress on Cybermatics: 2018 IEEE Conferences on Internet of Things, Green Computing and Communications, Cyber, Physical and Social Computing, Smart Data, Blockchain, Computer and Information Technology, iThings/GreenCom/CPSCom/SmartData/Blockchain/CIT 2018;"off-chain;privacy;scalability;zkSNARKs;ZoKrates;Blockchain;Data privacy;Internet of things;Problem oriented languages;Scalability;Computational effort;Domain specific languages;Non-interactive proof;Private information;Programming abstractions;Zero knowledge proof;zkSNARKs;ZoKrates;Green computing";Conference paper;;https://ieeexplore--ieee--org.us.debiblio.com/document/8726497;;;10.1109/Cybermatics_2018.2018.00199;9781538679753 (ISBN);;;N;N;N;N;N;Y;N;N;N;;ZoKrates;Y;N;N;N;Y;N;Agnostic approach, although the proof-of-concept has been implemented in Ethereum;Y;N;Blockchain;Information Systems Engineering (ISE) TU Berlin;Y;N;"Scalability and privacy are two challenges for today’s blockchain systems

moving computations from the blockchain to external nodes without compromising its properties is a more challenging problem.";Suduko Verification Example;Y;N;N; 
