9473;Smart-contract value-transfer protocols on a distributed mobile application platform;11;"Dai, P ; Mahi, N ; Earls, J ; Norta, A";Blockchain-enabled  smart  contracts  that  employ  proof-of-stake  validation  for  transactions,  promise  significant  performance  ad-vantages compared to proof-of-work solutions. For broad industry adop-tion, other important requirements must be met in addition. For exam-ple, stable backwards-compatible smart-contract systems must automatecross-organizational information-logistics orchestration with lite mobilewallets that support simple payment verification (SPV) techniques. Thecurrently leading smart-contract solution Ethereum, uses computation-ally expensive proof-of-work validation, is expected to hard-fork multipletimes in the future and requires downloading the entire blockchain. Con-sequently, Ethereum smart contracts have limited utility and lack formalsemantics, which is a security issue. This whitepaper fills the gap in thestate of the art by presenting the Qtum smart-contract framework thataims  for  sociotechnical  application  suitability,  the  adoption  of  formal-semantics language expressiveness, and the provision of smart-contracttemplate libraries for rapid best-practice industry deployment. We dis-cuss the Qtum utility advantages compared to the Ethereum alternativeand present Qtum smart-contract future development plans for industry-cases applications.;ACCEPTED;ACCEPTED;LOW;5;2017;Qtum Foundation,;smart  contract,  business  network  model,  DAPP,  mobile,information logistics, cross-organizational, peer-to-peer, distributed sys-tem, e-governance, Qtum framework;White Paper;;http://www.descryptions.com/Qtum.pdf,https://qtum.org/user/pages/01.home/Qtum%20whitepaper_en%20v0.7.pdf;;;;;;;N;N;N;N;N;Y;N;N;N;;Qtum Smart-Contract Language (QSCL) ontology based language;N;Y;N;N;Y;N;"Qtum
";N;Y;Smart Contract Mobile Device;"Qtum Foundation, Singapore
Large-Scale Systems Group, Tallinn University of Technology,";Y;N;"To support Qtum lifecycle management, the current lingua
franca Solidity lacks suitability. Consequently, the emerging Qtum-framework requires a novel smart-contract language with enhanced utility.

Qtum also recognizes that smart-contract lifecycle management requires applicationlayer development with sophisticated front-ender user experience that current solutions do not pay attention to sufficiently-";"real-life case from a failed seafood delivery 15 where a business-transaction conflict emerges from an underspecified
conventional contract (CC)";Y;N;N; 
9485;The Pact smart contract language;11;Popejoy, S;"Pact  is a new programming language for writing smart contracts to be  executed  by a  blockchain,    namely  Kadena,    the breakthrough    solution    for    private blockchains. Pact empowers    developers    to    implement robust,    performant  transactional    logic,    executing    
mission­critical    business    operations quickly    and    safely.";ACCEPTED;ACCEPTED;LOW;10;2017;;;White Paper;"Maybe to have it into account.
";http://kadena.io/docs/Kadena-PactWhitepaper.pdf;;;;;;;N;N;N;N;N;Y;N;N;N;;Pact;N;Y;N;N;Y;N;Kadena;Y;N;Private blockchain;kadena;N;Y;null;accounts module;Y;N;N; 
9492;Scilla: a smart contract intermediate-level language;11;"Sergey, I ; Kumar, A ; Hobor, A";"This paper outlines key design principles ofScilla—an intermediate level language for verifid smart contracts.
Scilla provides a clean separation between the communication aspect of smart contracts on a blockchain, allowing for the rich
interaction patterns, and a programming component, which enjoys principled semantics and is amenable to formal verifiation. Scilla
is not meant to be a high-level programming language, and we are going to use it as a translation target for high-level languages,
such as Solidity, for performing program analysis and verifiation, before further compilation to an executable bytecode.
We describe the automata-based model of Scilla, present its programming component and show how contract defiitions in
terms of automata streamline the process of mechanised verification of their safety and temporal properties.";ACCEPTED;ACCEPTED;LOW;10;2018;CoRR;;arXiv;"https://scilla-lang.org/
Blockchain platform Zilliqa (https://zilliqa.com/)(this information has been obtained by reading the scilla website, it is not in the original paper).
";;;;;;;;N;N;N;N;N;Y;N;N;N;;Scilla: a smart contract intermediate-level language;Y;N;N;N;Y;N;"Zilliqa
";Y;N;Safety;Zilliqa;N;Y;"(1)  defining a formal grammar and semantics of the language and implementing Scilla, as well as a developing and verifying a number of contracts in it, on a real-world blockchain platform.

One of the challenges of writing smart contracts is that the
implemented operational semantics of smart contract languages
admit rather subtle behaviour that diverge from the “intuitive understanding” of the language in the minds of contract developers";Crowdfunding;Y;N;N; 
9511;Safer smart contracts through type-driven development. Using dependent and polymorphic types for safer development of smart contracts;11;"Pettersson, J ; Edström, R";"We show how dependent and polymorphic types can make smart contract development safer. This is demonstrated by using the functional language Idris to describe smart contracts on the Ethereum platform. In particular, we show how one class of common errors can be captured at compile time using dependent types and algebraic side effects. We also bring type annotations to the realm of smart contracts,
helping developers to circumvent another class of common errors. To demonstrate the feasibility of our solutions, we have extended the Idris compiler with a backend for the Ethereum Virtual Machine.  While we find that the functional paradigm might not be the most suitable for the domain, our approach solves the identified problems and provides advantages over the languages in current use.
";ACCEPTED;ACCEPTED;LOW;5;2016;"Department of Computer Science and Engineering
CHALMERS UNIVERSITY OF TECHNOLOGY AND UNIVERSITY OF GOTHENBURG";"smart contracts; dependent types; polymorphic types; Ethereum; blockchain;
Idris; functional programming";Master Thesis;"It describes the use of Idris for writing smart contracts on Ethereum.

Functional";https://publications.lib.chalmers.se/records/fulltext/234939/234939.pdf;;;;;;;N;N;N;N;N;Y;N;N;N;;Idris;N;Y;N;N;Y;N;Ethereum;Y;N;Safety;CHALMERS U NIVERSITY OF T ECHNOLOGY AND U NIVERSITY OF G OTHENBURG;Y;N;"(1) An interesting future direction would b e to analyze real-life smart contracts written in our language, in order to identify additional common errors or patterns and investigate the possibility of eliminating or supp orting these using an extensive type system

(2) pure functions have no notion of communication, but Ethereum’s execution model is based entirely on messages that are sent between accounts, which it has in common

Formal verification aside, that the core language is unable to directly encode fundamental properties of the domain also suggests that the functional paradigm might not be the most suitable to use in practical development.

We believe that the problems we have discovered with the functional paradigm all hint in the direction of a language based on a process calculus. These models are designed to model concurrent and distributed systems, and view message passing as the fundamental operation of computation [48]. 

Regardless of which model we believe is suitable, evaluating different models of computation—e.g. the process calculi—with respect to the domain makes for very interesting future work.

we consider our revised choice of implementing side effects as primitive op erations an imp ortant advantage of our implementation. Not
only are they in fact primitive in this domain and more efficient, but this choice renders all parts of our library agnostic to the language targeted by the code generator,
thus easily reusable for future investigations into the field

owever, it is not clear whether a functional smart contract language is as beneficial as we initially envisioned, as noted in section 5.1.5. Admittedly, the problems we have identified are dependent on Ethereum’s execution model, namely that the system is based on accounts that send each other messages. Ethereum does have this in common with all smart contract platforms that we are aware of, but the field is still maturing and this may change. If it does, the functional paradigm
should be re-evaluated; for now, we conclude that further research is needed to find suitable paradigms for smart contract languages. We suggest that the process calculi are evaluated. They seem to encode the domain well, while most of them also lend themselves to formal verification and compositional program implementations";null;Y;N;N; 
9524;Designing secure Ethereum smart contracts: A finite state machine based approach;11;"Mavridou, A ; Laszka, A";he adoption of blockchain-based distributed computation platforms is growing fast. Some of these platforms, such as Ethereum, provide support for implementing smart contracts, which are envisioned to have novel applications in a broad range of areas, including finance and Internet-of-Things. However, a significant number of smart contracts deployed in practice suffer from security vulnerabilities, which enable malicious users to steal assets from a contract or to cause damage. Vulnerabilities present a serious issue since contracts may handle financial assets of considerable value, and contract bugs are non-fixable by design. To help developers create more secure smart contracts, we introduce FSolidM, a framework rooted in rigorous semantics for designing con- tracts as Finite State Machines (FSM). We present a tool for creating FSM on an easy-to-use graphical interface and for automatically generating Ethereum contracts. Further, we introduce a set of design patterns, which we implement as plugins that developers can easily add to their contracts to enhance security and functionality.;ACCEPTED;ACCEPTED;LOW;5;2017;CoRR;;arXiv;"To  help  developers  create  more  secure  smart  contracts,  we  introduce FSolidM ,  a  framework  rooted  in  rigorous  semantics  for  designing  contracts as Finite State Machines (FSM). 

I think it explain the same ideas than in Tool Demonstration: FSolidM for Designing Secure Ethereum Smart Contracts (0026), a previous accepted paper.";https://arxiv.org/pdf/1711.09327.pdf;;;abs/1711.09327;;;;N;N;N;N;N;Y;N;N;N;;FSolidM (based on FSM);N;Y;N;N;Y;N;Ethereum (Solidity) /Agnostic;Y;N;Security;"Vanderbilt University
University of Houston";Y;N;"(1) We plan to integrate model checkers and compositional verification tools into our framework to enable the verification of security and safety properties.
(1) We plan to extend our framework in multiple directions. First, we will introduce a number of plugins, implementing various security features and design patterns. We will provide security plugins for all the vulnerability types identified in [13] that can be addressed on the level of Solidity code. We will also
provide plugins implementing the most popular design patterns surveyed in [14].

(2) Second, we will integrate verification tools [11,12] and correctness-by-design techniques [21] into our framework.

(3) We will enable develop ers to mo del and verify multiple interacting
contracts as a set of interacting FSMs. ";null;N;Y;N; 
9551;Ekiden: A Platform for Confidentiality-Preserving, Trustworthy, and Performant Smart Contract Execution;11;"Raymond Cheng;Fan Zhang; Jernej Kos; Warren He; Nicholas Hynes; Noah M. Johnson; Ari Juels; Andrew Miller; Dawn Song";"Smart contracts are applications that execute on blockchains. Today they manage billions of dollars in value and motivate visionary plans for pervasive blockchain deployment. While smart contracts inherit the availability and other security assurances of blockchains, however, they are impeded by blockchains' lack of confidentiality and poor performance.
We present Ekiden, a system that addresses these critical gaps by combining blockchains with Trusted Execution Environments (TEEs). Ekiden leverages a novel architecture that separates consensus from execution, enabling efficient TEE-backed confidentiality-preserving smart-contracts and high scalability. Our prototype (with Tendermint as the consensus layer) achieves example performance of 600x more throughput and 400x less latency at 1000x less cost than the Ethereum mainnet.
Another contribution of this paper is that we systematically identify and treat the pitfalls arising from harmonizing TEEs and blockchains. Treated separately, both TEEs and blockchains provide powerful guarantees, but hybridized, though, they engender new attacks. For example, in naive designs, privacy in TEE-backed contracts can be jeopardized by forgery of blocks, a seemingly unrelated attack vector. We believe the insights learned from Ekiden will prove to be of broad importance in hybridized TEE-blockchain systems. ";ACCEPTED;ACCEPTED;LOW;5;2018;CoRR;;arXiv;"I don't know clearly if Ekiden provides a new Smart contract language, so I'll add it just in case.
DISCUSSION:
TR- Tengo dudas del lenguaje. El articulo habla del sistema y dice que los smart contracts están
AJ- Aceptamos. Soporta multiples lenguajes de Smart Contract pero aumenta capacidades de los mismos.		";https://arxiv.org/pdf/1804.05141.pdf;abs/1804.05141;;;;;;N;N;N;N;N;Y;N;N;N;;Ekiden contracts;N;Y;N;N;Y;N;Ekiden;Y;N;Confidentiality; UC Berkeley Cornell Tech UIUC Oasis Labs;Y;N;The system currently does not support calling contract functions from another contract. We leave this for future work.;"credit scoring application
Machine Learn ing Contracts:
Smart Building Thermal Modeling:
Tokens:
Poker
CryptoKitties
Origin
";Y;N;N; 
9657;A modern programming language for smart contracts;11;Roberts, N;"Blockchain platforms such as Ethereum have risen in popularity with programmers wishing to deploy their own decentralized applications (“smart contracts”). Because execution cost is paid in real currency, it’s desirable for smart contract programming languages to provide high-level features that clearly correspond to the cost model of Ethereum.
In this report, we introduce a language for writing smart contracts based on OCaml, a popular multi-paradigm language. The main technical contribution is retargeting the OCaml bytecode compiler to the Ethereum Virtual Machine. We evaluate the performance and usability of this implementation relative to Solidity, the most popular smart contract language. This is a fist step towards using Resource Aware
ML to automatically predict the execution cost of smart contracts";ACCEPTED;ACCEPTED;LOW;10;2018;andrew.cmu.edu;Compilers, blockchain, Ethereum, Resource Aware ML;Report;"Es un report.

Ahora mismo no hay acceso";https://ncik-roberts.github.io/15400/files/report.pdf;;;;;;;N;N;N;N;N;Y;N;N;N;;null ¿OCaml?;Y;N;N;N;Y;N;Ethereum;Y;N;bytecode, EVM retargeting;Carnegie Mellon University;Y;N;"In future work, this implementation could allow for interfacing with existing static analysis tools related to OCaml, such as Resource Aware ML.

The original motivation for this work was to develop a framework for bounding the resource consumption of smart contracts. Resource Aware ML (RAML)[5] is such a resource analysis framework for a language similar to OCaml, so we wished to investigate whether its techniques could be extended to a setting of the blockchain

To make OCaml feasible as a frontend language for Ethereum developers, performance is the path forward";lottery contract;Y;N;N; 
9692;Formal Modeling and Verification of Smart Contracts;11;"Bai, X ; Cheng, Z ; Duan, Z ; Hu, K";Smart contracts can automatically perform the contract terms according to the received information, and it is one of the most important research fields in digital society. The core of smart contracts is algorithm contract, that is, the parties reach an agreement on the contents of the contract and perform the contracts according to the behaviors written in certain computer algorithms. It not only needs to make sure about the correctness of smart contracts code, but also should provide a credible contract code execution environment. Blockchain provides a trusted execution and storage environment for smart contracts by the distributed secure storage, consistency verification and encryption technology. Current challenge is how to assure that smart contract can be executed as the parties' willingness. This paper introduces formal modeling and verification in formal methods to make smart contract model and verify the properties of smart contracts. Formal methods combined with smart contracts aim to reduce the potential errors and cost during contract development process. The description of a general and formal smart contract template is provided. The tool of model checking, SPIN, is used to verify the correctness and necessary properties for a smart contract template. The research shows model checking will be useful and necessary for smart contracts;ACCEPTED;ACCEPTED;LOW;5;2018;ICSCA 2018: Proceedings of the 2018 7th International Conference on Software and Computer Applications;Formal Verification, Formal methods, Model checking, Modeling, SPIN, Smart contracts ;Conference Paper;It could be seen as a formal smart contract language, so I'm going to add it, just in case.;https://dl.acm.org/citation.cfm?id=3185138;;322-326;10.1145/3185089.3185138;978-1-4503-5414-1;;;N;N;N;N;N;Y;N;N;N;;null;N;Y;N;N;Y;N;null;Y;N;Verification;"Beihang University, Beijing
Laboratory of Space-Ground Integrated Information Technology, Beijing Institute of Satellite Information Engineering,";Y;N;"The research shows model checking will be useful and necessary
for smart contracts.";Shopping smart contract;N;Y;N; 
9710;An introduction to Commitment Based Smart Contracts using ReactionRuleML;11;"Kruijff, J de ; Weigand, H";Smart contracts gain rapid exposure since the inception of blockchain technology.    Today's  smart  contracts  are  coded  in  non-mainstream procedural  programming  languages  (e.g.  Solidity  for  Ethereum), which lifts the requirement to draft enterprise ready smart contract to both a legal professional and a programmer instead of only the former. In search for a smart contract languagethat reduces the threshold to draft one, this conceptual paper elaborates how business logic can be converted to executable codeforcommitment-based smart contracts. Hereby, a contract is viewed as a set of reciprocal commitments. Thesmart contract ensuresthe automated execution of all or most of these commitments. In  order  to  leverageits  event  processing  capabilities, Reaction RuleML has  been used to  appropriately  represent the elements and   working ofpassive   and   active ruleswithin   acommitment based smart;ACCEPTED;ACCEPTED;LOW;5;2018;Proceedings of the 12th International Workshop on Value Modeling and Business Ontologies;RuleML, Reaction  RuleML,  Blockchain,Commitment-Based Smart Contracts;Workshop paper;It uses RuleML as a language for defining Smart-Contract;http://ceur-ws.org/Vol-2239/article_16.pdf;2239;149-157;;1613-0073;;;N;N;N;N;N;Y;N;N;N;;Reaction RuleML ;N;Y;N;N;N;Y;n/a;N;Y;"legal practice
commitment-based smart contracts";Tilburg University;Y;N;"(1) An important next step for the development of commitment based smart
contracts as a concept is to apply it in distinctive use-cases and
implementation options.
(2) as well as the verification of input events, in particular when these events are outside the blockchain.";null;N;Y;N; 
9784;Fun with Bitcoin smart contracts;11;"Bartoletti, M ; Cimoli, T ; Zunino, R";Besides simple transfers of currency, Bitcoin also enables various forms of smart contracts, i.e. protocols where users interact within pre-agreed rules, which determine (possibly depending on the actual interaction) how currency is eventually distributed. This paper provides a gentle introduction to Bitcoin smart contracts, which we specify by abstracting from the underlying Bitcoin machinery. To this purpose we exploit BitML, a recent DSL for smart contracts executable on Bitcoin.;ACCEPTED;ACCEPTED;LOW;5;2018;International Symposium on Leveraging Applications of Formal Methods ISoLA 2018: Leveraging Applications of Formal Methods, Verification and Validation. Industrial Practice ;;Conference paper;This paper provides a gentle introduction to Bitcoin smart contracts, which we specify byabstracting from the underlying Bitcoin machinery. To this purpose weexploit BitML, a recent DSL for smart contracts executable on Bitcoin;https://link.springer.com/chapter/10.1007/978-3-030-03427-6_32;11247;;https://doi.org/10.1007/978-3-030-03427-6_32;978-3-030-03427-6;;;N;N;N;N;N;Y;N;N;N;;BitML;N;Y;N;N;Y;N;Bitcoin;N;Y;"Safety
";"Universit` a degli Studi di Cagliari, Cagliari, Italy
Universit` a degli Studi di Trento, Trento, Italy";Y;N;"Although BitML can express many of the smart contracts appeared in the literature [4], there exist some contracts which can be executed on Bitcoin but are not expressible in BitML. Ex. contingent payment contracts.

Another kind of contracts which are not expressible in BitML are
those for which one cannot pre-determine a finite set of transactions, or of signatures, before executing the contract. This is the case, e.g. , of crowdfunding contracts

The existence of negative results on the expressiveness of Bitcoin contracts is still an open question";"contract advertisement 
Direct Payment
Payment from Multiple Senders
Procrastinating Payments
Authorizing Payments
Splitting Deposits
Volatile Deposits
Revealing Secrets
Lotteries and Other Games";Y;N;N; 
9868;BitML: a calculus for Bitcoin smart contracts;11;"Bartoletti, M ; Zunino, R";"We intro duce BitML, a domain-specifi language for specifying contracts that regulate transfers of bitcoins among participants,
without relying on trusted intermediaries. We defnie a symbolic and a computational mo del for reasoning about BitML security. In
the symbolic model, participants act according to the semantics of BitML, while in the computational mo del they exchange bitstrings,
and read/app end transactions on the Bitcoin blo ckchain. A compileris provide d to translate contracts into standard Bitcoin transactions.
Participants can execute a contract by app ending these transactions on the Bitcoin blo ckchain, according to their strategies. We prove
the correctness of our compiler, showing that computational attacks on compiled contracts are also obser vable in the symbolic model.";ACCEPTED;ACCEPTED;LOW;5;2018;Proceedings of the 2018 ACM SIGSAC Conference on Computer and Communications Security (CCS '18);"Bitcoin; smart contracts; process calculi";Conference Paper;;https://dl.acm.org/citation.cfm?doid=3243734.3243795;;83-100;https://doi.org/10.1145/3243734.3243795;978-1-4503-5693-0;;;N;N;N;N;N;Y;N;N;N;;BitML;N;Y;N;N;Y;N;Bitcoin;N;Y;Safety;"University of Cagliari
University of Trento";Y;N;Although BitML can express many of the smart contracts appeared in literature [14], it has some limitations. For instance, it cannot express contingent payments, ;null;Y;N;N; 
309615;Solidity Documentation;13;Ethereum;;ACCEPTED;ACCEPTED;LOW;0;2019;;;WebSite;https://solidity.readthedocs.io/en/develop/;https://solidity.readthedocs.io/en/latest/;;;;;07/01/2019;;N;N;N;N;N;Y;N;N;N;;Solidity;Y;N;N;N;Y;N;Ethereum;Y;N;Blockchain;Independant and Ethereum developers;N;Y;null;"voting, 
crowdfunding, 
blind auctions, 
and multi-signature wallets.";Y;N;N; 
309616;DAML SDK Documentation;13;Digital Asset (Switzerland) GmbH;;ACCEPTED;ACCEPTED;LOW;0;2017;;;WebSite;https://daml.com/;https://docs.daml.com/_downloads/DigitalAssetSDK.pdf;;;;;07/01/2019;;N;N;N;N;N;Y;N;N;N;;DAML;Y;N;N;N;Y;N;Digital Asset Ledger;Y;N;"multi-party business processes
These are examples: Financial products and services
";Digital ASset;N;Y;null;Financial products and services;Y;N;N; 
316904;A Formal Language for Analyzing Contracts;14;Nick Szabo;;ACCEPTED;ACCEPTED;LOW;0;2002;;;WebSite;;https://nakamotoinstitute.org/contract-language/;;;;;07/01/2019;;N;N;N;N;N;Y;N;N;N;;null;N;Y;N;N;N;Y;n/a;N;Y;"Verification
financial contracts
financial contracts, liens and other kinds of security, transfer of ownership, performance of online services, and supply chain workflow.";"Satoshi Nakamoto Institute

";Y;N;Implementations that satisfy the above assumptions for the particular language atoms, and also for compositions of the atoms.;"* well-known financial contract, the future
* another kind of financial contract the option
* Damage Clauses
* Insurance
* multiparty agreements
* Hooking Up Machines";N;Y;N; 
