730955;Write your next Ethereum Contract in Pyramid Scheme;79;Michael Burge;;ACCEPTED;ACCEPTED;LOW;0;2017;IDEALS. Illinois Digital Environment for Access to Learning and Scholarship;;White paper;"https://medium.com/coinmonks/write-your-next-ethereum-contract-in-pyramid-scheme-6b6e4deadf2f
https://medium.com/coinmonks/dsls-for-ethereum-contracts-380136177abd
https://github.com/MichaelBurge/pyramid-scheme";https://medium.com/coinmonks/write-your-next-ethereum-contract-in-pyramid-scheme-6b6e4deadf2f;;;;;09/29/2019;;N;N;N;N;N;Y;N;N;N;;Pyramid;Y;N;N;N;Y;N;Ethereum;N;Y;null;Michael Burge;N;Y;null;null;Y;N;N; 
730956;EthIR: A Framework for High-Level Analysis of Ethereum Bytecode;79;Elvira Albert andPablo Gordillo andBenjamin Livshits andAlbert Rubio andIlya Sergey;;ACCEPTED;ACCEPTED;LOW;0;2018;Automated Technology for Verification and Analysis - 16th InternationalSymposium, {ATVA} 2018, Los Angeles, CA, USA, October 7-10, 2018,Proceedings;;Conference paper;;https://doi.org/10.1007/978-3-030-01090-4\_30;11138;513--520;10.1007/978-3-030-01090-4\_30;;09/29/2019;;N;N;N;N;N;Y;N;N;N;;Rule Based Representation (RBR);N;N;Y;N;Y;N;Ethereum;Y;N;Bytecode analysis;Universidad Complutense Madrid;Y;N;null;Bounding loops;Y;N;N; 
730957;IELE: An intermediate level Blockchain language designed and implemented using formal semantics;79;Theodoros Kasampalis and Dwight Guth and Brandon Moore and Traian Serbanuta and Virgil Serbanuta and Daniele Filaretti and Grigore Rosu and  Ralph Johnson;Most languages are given an informal semantics until they are implemented, so the formal semantics comes later. Consequently, there are usually inconsistencies among the informal semantics, the implementation, and the formal semantics. IELE is an LLVM-like language for the blockchain that was specified formally and its implementation, a virtual machine, generated from the formal specification. Moreover, its design was based on problems observed formalizing the semantics of the Ethereum Virtual Machine (EVM) and from formally specifying and verifying EVM programs (also called “smart contracts”), so even the design decisions made for IELE are based on formal specifications. A compiler from Solidity, the predominant high-level language for smart contracts, to IELE has also been implemented, so Ethereum contracts can now also be executed on IELE. The virtual machine automatically generated from the semantics of IELE is shown to be competitive in terms of performance with the state of the art and hence can stand as the de facto implementation of the language in a production setting. Indeed, IOHK, a major blockchain company, is currently experimenting with the IELE VM in order to deploy it as its computational layer in a few months. This makes IELE the first practical language that is designed and implemented as a formal specification. It took only 10 man-months to develop IELE, which demonstrates that the programming language semantics field has reached a level of maturity that makes it appealing over the traditional, adhoc approach even for pragmatic reasons.;ACCEPTED;ACCEPTED;LOW;5;2018;;;Report;;https://www.ideals.illinois.edu/handle/2142/100320;;;;;09/29/2019;;N;N;N;N;N;Y;N;N;N;;IELE;Y;N;N;N;N;Y;Agnostic;Y;N;null;Runtime Verification, Inc;N;Y;null;null;N;Y;N; 
730958;Ethereum flavored WebAssembly (ewasm);79;Alex Beregszaszi and Norton Wang and Guillaume Ballet and Hugo and Jake Lang and jwasinger and Lane Rettig and wanderer;;ACCEPTED;ACCEPTED;LOW;0;2019;;;GitHub page;;https://github.com/ewasm/design;;;;;09/29/2019;;N;N;N;N;N;Y;N;N;N;;ewasm;Y;N;N;N;Y;N;Ethereum;Y;N;null;null;Y;N;null;null;Y;N;N; 
790567;IELE: A Rigorously Designed Language and Tool Ecosystem for the Blockchain;80;Kasampalis, Theodorosand Guth, Dwightand Moore, Brandonand È˜erb{\u{a}}nuÈ›{\u{a}}, Traian Florinand Zhang, Yiand Filaretti, Danieleand È˜erb{\u{a}}nuÈ›{\u{a}}, Virgiland Johnson, Ralphand Ro{\c{s}}u, Grigore;This paper proposes IELE, an LLVM-style language, together with a tool ecosystem for implementing and formally reasoning about smart contracts on the blockchain. IELE was designed by specifying its semantics formally in the K framework. Its implementation, a IELE virtual machine (VM), as well as a formal verification tool for IELE smart contracts, were automatically generated from the formal specification. The automatically generated formal verification tool allows us to formally verify smart contracts without any gap between the verifier and the actual VM. A compiler from Solidity, the predominant high-level language for smart contracts, to IELE has also been (manually) implemented, so Ethereum contracts can now also be executed on IELE.;ACCEPTED;ACCEPTED;LOW;23;2019;"International Symposium on Formal Methods
FM 2019: Formal Methods – The Next 30 Years pp";;Conference paper;"Definitely yes
Note: I think the approach is supported by industry because of the following statement:
We have deployed the IELE VM in a testnet supported by IOHK, a major blockchain company [16]

We believe that the novelty in the design of IELE, compared to those efforts, stems from the fact that its formal specification and its de-facto implementation are one and the same artifact: any change to IELE’s specification is automatically propagated to the implementation of the language execution engine and verification tools.

CHECK: Decide if it is industrial or not
";https://doi.org/10.1007/978-3-030-30942-8_35;11800;593--610;https://doi.org/10.1007/978-3-030-30942-8_35;978-3-030-30942-8;05/26/2020;;N;N;N;N;N;Y;N;N;N;;IELE;Y;N;N;N;Y;N;Ethereum??;Y;N;"security, verification, human-readability, and portability in mind
VM Level.";"University of Illinois at Urbana-Champaign, Urbana, 
Runtime Verification, Urbana, USA
University of Bucharest, Bucharest, Romania";N;Y;"security, verification, human-readability, and portability in mind

We believe that the novelty in the design of IELE, compared to those efforts, stems from the fact that its formal specification and its de-facto implementation are one and the same artifact: any change to IELE’s specification is automatically propagated to the implementation of the language execution engine and verification tools.
";null;Y;N;N; 
790573;A Minimal Core Calculus for Solidity Contracts;80;Bartoletti, Massimoand Galletta, Letterioand Murgia, Maurizio;The Ethereum platform supports the decentralized execution of smart contracts, i.e. computer programs that transfer digital assets between users. The most common language used to develop these contracts is Solidity, a Javascript-like language which compiles into EVM bytecode, the language actually executed by Ethereum nodes. While much research has addressed the formalisation of the semantics of EVM bytecode, relatively little attention has been devoted to that of Solidity. In this paper we propose a minimal calculus for Solidity contracts, which extends an imperative core with a single primitive to transfer currency and invoke contract procedures. We build upon this formalisation to give semantics to the Ethereum blockchain. We show our calculus expressive enough to reason about some typical quirks of Solidity, like e.g. re-entrancy.;ACCEPTED;ACCEPTED;LOW;12;2019;Data Privacy Management, Cryptocurrencies and Blockchain Technology;"Ethereum; Smart contracts; Solidity ";Conference paper;"Dudoso: "" In this paper we propose a minimal calculus for Solidity contracts, which extends an imperative core with a single primitive to transfer currency and invoke contract procedures ...""";https://link--springer--com.us.debiblio.com/chapter/10.1007/978-3-030-31500-9_15;11737;233--243;https://doi.org/10.1007/978-3-030-31500-9_15 ;978-3-030-31500-9;05/26/2020;;N;N;N;N;N;Y;N;N;N;;TinySol;Y;N;N;N;Y;N;null;Y;N;"formalization
";Universit`a Degli Studi di Cagliari, Cagliari, Italybart@unica.it2IMT Lucca, Lucca, Italy3Universit`a di Trento, Trento, Italy;Y;N;null;null;Y;N;N; 
790601;A Three-Layered Approach for Designing Smart Contracts in Collaborative Processes;80;Bagozi, Adaand Bianchini, Devisand De Antonellis, Valeriaand Garda, Massimilianoand Melchiori, Michele;"In collaborative environments, where enterprises interact each other's without a centralised authority that ensures trust among them, the ability of providing cross-organisational services must be enabled also between mutually untrusting participants. Blockchain platforms and smart contracts have been proposed to implement collaborative processes. However, current solutions are platform-dependent and deploy on-chain the whole process, thus increasing the execution costs of smart contracts if deployed on permissionless blockchain. In this paper, we propose an approach that includes criteria to identify trust-demanding objects and activities in collaborative processes, a model to describe smart contracts in a platform-independent way and guidelines to deploy them in a blockchain. To this aim, a three-layered model is used to describe: (i) the collaborative process, represented in BPMN, where the business expert is supported to add annotations that identify trust-demanding objects and activities; (ii) Abstract Smart Contracts based on trust-demanding objects and activities only and specified by means of descriptors, that are independent from any blockchain technology; (iii) Concrete Smart Contracts, that implement abstract ones and are deployed over a specific blockchain, enabling the creation of a repository where a single descriptor is associated with multiple implementations. The flexibility and reduced costs of the approach, due to the smart contracts abstraction and the use of blockchain only when necessary, are discussed with a case study on remote monitoring services in the digital factory.";ACCEPTED;ACCEPTED;LOW;23;2019;"OTM Confederated International Conferences ""On the Move to Meaningful Internet Systems""
OTM 2019: On the Move to Meaningful Internet Systems: OTM 2019 Conferences ";"Blockchain;Smart contract;Collaborative processes ";Conference paper;Abstract Smart Contracts(ASC) maybe the intermediate models could be considered.;https://doi.org/10.1007/978-3-030-33246-4_28;;440--457;https://doi.org/10.1007/978-3-030-33246-4_28;978-3-030-33246-4;05/26/2020;;N;N;N;N;N;Y;N;N;N;;Abstract Smart Contracts(ASC).;N;Y;N;N;N;Y;null;Y;N;null;Department of Information Engineering, University of Brescia, Italy;Y;N;null;null;Y;N;N; 
790630;Towards Self-automatable and Unambiguous Smart Contracts: Machine Natural Language;80;Qin, Pengand Guo, Jingzhiand Shen, Bingqingand Hu, Quanyi;A smart contract originally drafted by natural language is an essential task of many applications in blockchain technology. Firstly, natural language cannot be directly executed by computers, self-executing requires terms of the smart contract be computer-readable and executable. Secondly, in crossing environments or parties, contract translation needs the overall meaning of a sentence to have a meticulous precision, besides, low tolerance of mistakes for reducing a tedious process. Lastly, many kinds of templates of smart contracts need a common sense of agreement where each party agrees on the context of the contract. This paper explores the problems of the smart contract in natural language and self-executing to redefine the smart contract through an approach, which supports a human-readable, computer-understandable and self-executable contract representations with enabling semantic structural based on Machine Natural Language (MNL). Meanwhile, a common dictionary (CoDic) transfers natural languages into universal machine codes or languages without the ambiguity across parties.;ACCEPTED;ACCEPTED;LOW;43;2020;Advances in E-Business Engineering for Ubiquitous Computing;"Machine natural language; Smart contracts; Semantic document; Universal grammar ";Conference Paper;They propopse Machine Natural language (MNL) a language very close to natural language and they say it is autoexecutable.;https://doi.org/10.1007/978-3-030-34986-8_34;41;479--491;https://doi.org/10.1007/978-3-030-34986-8_34;978-3-030-34986-8;05/26/2020;;N;N;N;N;N;Y;N;N;N;;Machine Natural language (MNL);N;Y;N;N;Y;N;null;Y;N;null;Faculty of Science and Technology, University of Macau, Macau, China;Y;N;null;null;Y;N;N; 
790671;Das Contract - A Visual Domain Specific Language for Modeling Blockchain Smart Contracts;80;Skotnica, Marekand Pergl, Robert;A Blockchain (BC) is a technology that introduces a decentralized, replicated, autonomous, and secure databases. A smart contract (SC) is a transaction embedded in the blockchain that contains executable code and its internal storage, offering immutable execution and record keeping. The SC has enormous potential in automating traditional paper contracts and encoding contract logic into program code. Thus, replacing the role of a notary and a central authority. It may dramatically reduce an effort with administration workload and enforcement of such contracts. In this paper, we propose a new visual domain specific language that can capture the SC in a user-friendly way and eliminate the errors associated with programming since the SC code is automatically generated from models. Finally, an open-source proof-of-concept environment for designing and generating the SC is introduced to demonstrate the feasibility of proposed concepts.;ACCEPTED;ACCEPTED;LOW;16;2020;"Enterprise Engineering Working Conference
EEWC 2019: Advances in Enterprise Engineering XIII";"Enterprise Engineering; DEMO methodology; Blockchain; Smart contract";Conference paper;;;;149--166;https://doi.org/10.1007/978-3-030-37933-9_10;978-3-030-37933-9;05/26/2020;;N;N;N;N;N;Y;N;N;N;;Das Contract;Y;N;N;N;Y;N;Agnostic, although the proof of concept is made with Ethereum Solidity.;Y;N;null;null;Y;N;null;null;Y;N;N; 
790696;A Java Framework for Smart Contracts;80;Spoto, Fausto;This article defines a framework for programming, in Java, smart contracts over blockchain. The framework consists of a restricted runtime and of an instrumentation procedure for classes that need to be persisted to blockchain, for payable contract methods and for gas metering. This instrumentation abstracts away any difference between storage and memory data location, which is at the origin of tricky semantical issues and bugs in Solidity. Moreover, this framework allows one to leverage, in a transparent way, existing expertise and tools from the Java world, in order to build smart contracts in a simple and comfortable way. The resulting contracts are strongly-typed and work over a shared storage, that allows simple intercontract communication. This makes it easy to install libraries or microservices in blockchain.;ACCEPTED;ACCEPTED;LOW;11;2020;"International Conference on Financial Cryptography and Data Security
FC 2019: Financial Cryptography and Data Security ";;Conference paper;"Dudoso: This article defines a framework for programming, in Java, smart contracts over blockchain.

We could think of the framework as a DSL that is implemented as a Java Extension.
";https://link--springer--com.us.debiblio.com/chapter/10.1007/978-3-030-43725-1_10;11599;122--137;https://doi.org/10.1007/978-3-030-43725-1_10;978-3-030-43725-1;05/26/2020;;N;N;N;N;N;Y;N;N;N;;Takamaka;Y;N;N;N;N;Y;The implementation of the framework requires the blockchain to be equippedwith primitives to serialise and deserialise storage objects (Sect.3). Hence, itcannot be immediately implemented on the Ethereum blockchain. Our projectcontinues now with the implementation of a blockchain that provides such prim-itives and with the actual evaluation of the framework.;N;Y;null;Department of Computer Science, Universit`a di Verona, Verona, Italy;Y;N;null;null;Y;N;N; 
790721;Modeling of Smart Contracts in Blockchain Solution for Renewable Energy Grid;80;G{\'o}rski, Tomaszand Bednarski, Jakub;The paper presents the manner of smart contracts' modeling in blockchain solution. The authors illustrate the modeling approach using the example of a renewable energy system. The paper proposes extension of Unified Modeling Language (UML) in form of UML Profile for Smart Contracts, appropriate for smart contract design. Moreover, the standard smart contract design and implementation method, in Corda environment, has been made more flexible. The authors present static aspect of newly designed Smart Contract Design Pattern.;ACCEPTED;ACCEPTED;LOW;23;2020;"International Conference on Computer Aided Systems Theory
EUROCAST 2019: Computer Aided Systems Theory – EUROCAST 2019 ";"Software architecture;Blockchain;Smart contract;Distributed ledger;Architectural views model 1+5";Conference paper;It presents a UML profile for modeling UML contracts.;https://doi.org/10.1007/978-3-030-45093-9_61;12013;507--514;https://doi.org/10.1007/978-3-030-45093-9_61;978-3-030-45093-9;05/26/2020;;N;N;N;N;N;Y;N;N;N;;UML Profile;N;Y;N;N;Y;N;It is supposed to be agnostic, but they are focused on CORDA;N;Y;Our aim is to provide flexible and easy to extend manner of modeling and implementation of smart contracts in such solutions. The article is focused on this very aim;Institute of Naval Weapons and Computer Science,Polish Naval Academy, Gdynia, Poland;N;Y;null;Renewable Energy Grid;Y;N;N; 
790727;Logic-Based Smart Contracts;80;Stancu, Adrianaand Dragan, Mihaita;With the increasing popularity and diversity of Blockchain systems, smart contracts were introduced as a necessity to automatically execute certain operation depending on the occurred events. The programming languages used in defining the triggering events and their consequent actions depends on the Blockchain implementation. In this article, we will investigate the advantages and suitable scenarios for using a formal approach in defining smart contracts. We will use a particular python implementation of a Blockchain and add the interface with a Prolog component for defining and querying smart contracts.;ACCEPTED;ACCEPTED;LOW;17;2020;Trends and Innovations in Information Systems and Technologies;"Smart contract; Logic programming; Distributed database";Conference paper;"Related work??  In this article, we will investigate the advantages and suitable scenarios for using a formal approach in defining smart contracts.
It seems that it could be accepted, but I cannot download the paper";;;387--394;https://doi.org/10.1007/978-3-030-45688-7_40 ;978-3-030-45688-7;05/26/2020;;N;N;N;N;N;Y;N;N;N;;null;Y;N;N;N;Y;N;null;Y;N;null;null;Y;N;null;null;Y;N;N; 
790732;Smart Contract Locator (SCL) and Smart Contract Description Language (SCDL);80;"Lamparelli, Andreaand Falazi, Ghareeband Breitenb{\""u}cher, Uweand Daniel, Florianand Leymann, Frank";Today's blockchain technologies focus mostly on isolated, proprietary technologies, yet there are application scenarios that ask for interoperability, e.g., among blockchains themselves or with external applications. This paper proposes the Smart Contract Locator (SCL) for the unambiguous identification of smart contracts over the Internet and across blockchains, and the Smart Contract Description Language (SCDL) for the abstract description of the external interface of smart contracts. The paper derives a unified metamodel for blockchain smart contract description and equips it with a concrete, JSON-based description language for smart contract search and discovery. The goal of the proposal is to foster smart contract reuse both inside blockchains and through the integration of smart contracts inside enterprise applications. The idea is inspired by the Service-Oriented Architecture (SOA) and aims to provide a high-level, cross-blockchain interoperability layer.;ACCEPTED;ACCEPTED;LOW;45;2020;Service-Oriented Computing -- ICSOC 2019 Workshops;"Blockchain;Smart contracts;Description·SCDL;SCL";Workshop paper;It is the same language than the one introduced in 802068. I have doubts with both of them. As a consequence, or both accepted or both rejected.;https://doi.org/10.1007/978-3-030-45989-5_16;12019;195--210;https://doi.org/10.1007/978-3-030-45989-5_16;978-3-030-45989-5;05/26/2020;;N;N;N;N;N;Y;N;N;N;;Smart Contract Description Language (SCDL);Y;N;N;N;Y;N;null;Y;N;null;null;Y;N;null;null;Y;N;N; 
790780;Aplos: Smart Contracts Made Smart;80;Bandara, Erangaand Ng, Wee Keongand Ranasinghe, Nalinand De Zoysa, Kasun;Smart contract is a programming interface to interact with the underlying blockchain storage models. It is a database abstraction layer for blockchain. Existing smart contract platforms follow the imperative style programming model since states are shared. As a result, there is no concurrency control mechanism when executing transactions, resulting in considerable latency and hindering scalability. To address performance and scalability issues of existing smart contract platforms, we design a new smart contract platform called ``Aplos'' based on the Scala functional programming language and Akka actors. In Aplos, all blockchain-related smart contract functions are implemented with Akka actors. The Aplos platform is built over Mystiko---a highly scalable blockchain storage for big data. Mystiko supports concurrent transactions, high transaction throughput, data analytics and machine learning. With Aplos smart contracts over Mystiko, we have developed a blockchain for highly scalable storage that aligns with big data requirements.;ACCEPTED;ACCEPTED;LOW;26;2020;"International Conference on Blockchain and Trustworthy Systems
BlockSys 2019: Blockchain and Trustworthy Systems ";"Blockchain;Smart contract; Functional programming;Actor model; Big data; Scala; Akka ";Conference paper; To address performanceand scalability issues of existing smart contract platforms, we design anew smart contract platform called “Aplos” based on the Scala func-tional programming language and Akka actors. In Aplos, all blockchain-related smart contract functions are implemented with Akka actors. TheAplos platform is built over Mystiko—a highly scalable blockchain storagefor big data.;https://doi.org/10.1007/978-981-15-2777-7_35;;431--445;https://doi.org/10.1007/978-981-15-2777-7_35;978-981-15-2777-7;05/26/2020;;N;N;N;N;N;Y;N;N;N;;Aplos platform, SM written in Scala;Y;N;N;N;Y;N;Mystiko;Y;N;null;School of Computer Science and Engineering,Nanyang Technological University, Singapore, Singapore Colombo School of Computing, Colombo, Sri Lanka;Y;N;null;null;Y;N;N; 
790884;NEO Blockchain and Smart Contracts;80;Elrom, Elad;In Chapter 1, I covered the NEO proof of stake (PoS) blockchain consensus mechanism. In Chapter 2, you created a NEO bookkeeping node on AWS Ubuntu and learned how to request a consensus authority certificate and get elected as a bookkeeper.;ACCEPTED;ACCEPTED;LOW;5;2019;The Blockchain Developer: A Practical Guide for Designing, Implementing, Publishing, Testing, and Securing Distributed Blockchain-based Projects;;Book Chapter;"Dudoso: I think should be rejected but Im not sure 
It defines c almohadilla to write smart contracts for neo.";https://doi.org/10.1007/978-1-4842-4847-8_7;;257--298;10.1007/978-1-4842-4847-8_7;978-1-4842-4847-8;05/26/2020;;N;N;N;N;N;Y;N;N;N;;c almohadilla;Y;N;N;N;Y;N;Neo;Y;N;null;null;Y;N;null;null;Y;N;N; 
790886;EOS.IO Wallets and Smart Contracts;80;Elrom, Elad;"In Chapter 2, I introduced EOS.IO when I covered bitcoin, altcoins, and different consensus mechanisms. Specifically, I covered how EOS.IO is an example of altcoins that turn into tokens; you created an EOS block producer and were able to create a full node capable of mining EOS tokens. Ethereum was the beginning of your blockchain smart contract development, and you learned to use the Solidity language to write smart contracts and dapps. EOS.IO has created a more robust architecture than Ethereum for smart contract and dapp development.";ACCEPTED;ACCEPTED;LOW;17;2019;The Blockchain Developer: A Practical Guide for Designing, Implementing, Publishing, Testing, and Securing Distributed Blockchain-based Projects;;Book Chapter;"Dudoso
Aceptado.
It presents Smart contracts written in C++ for EOS.IO.";https://doi.org/10.1007/978-1-4842-4847-8_6;;213--256;10.1007/978-1-4842-4847-8_6;978-1-4842-4847-8;05/26/2020;;N;N;N;N;N;Y;N;N;N;;C++;Y;N;N;N;Y;N;EOS.IO;Y;N;null;null;Y;N;null;null;Y;N;N; 
790958;On the Prediction of Smart Contracts' Behaviours;80;Laneve, Cosimoand Coen, Claudio Sacerdotiand Veschetti, Adele;Smart contracts are pieces of software stored on the blockchain that control the transfer of assets between parties under certain conditions. In this paper we analyze the bahaviour of smart contracts and the interaction with external actors in order to maximize objective functions. We define a core language of programs with a minimal set of smart contract primitives and we describe the whole system as a parallel composition of smart contracts and users. We therefore express the system behaviour as a first logic formula in Presburger arithmetics and study the maximum profit for each actor by solving arithmetic constraints.;ACCEPTED;ACCEPTED;LOW;20;2019;From Software Engineering to Formal Methods and Tools, and Back: Essays Dedicated to Stefania Gnesi on the Occasion of Her 65th Birthday;;Book Chapter;"In this paper we have introduced a unified calculus for modelling smart contracts and users, which are the primary actors of decentralized applications.
 I have certain doublts";https://doi.org/10.1007/978-3-030-30985-5_23;;397--415;10.1007/978-3-030-30985-5_23;978-3-030-30985-5;05/26/2020;;N;N;N;N;N;Y;N;N;N;;In this paper we have introduced a unified calculus for modelling smart contracts and users, which are the primary actors of decentralized applications.;Y;N;N;N;Y;N;null;Y;N;SC Behaviour;Department of Computer Science and Engineering,University of Bologna – INRIA Focus, Bologna, Italy;Y;N;null;null;N;Y;N; 
